movieName;Metascore_w;Author;AuthorHref;Date;Summary;InteractionsYesCount;InteractionsTotalCount;InteractionsThumbUp;InteractionsThumbDown;sentiment_tuple;sentiment_polarity;sentiment_subjectivity;rel_sent;abs_sent
kung-fu-panda;8;gameguardian21;/user/gameguardian21;Mar 20, 2016;"[ ""This is the start to one of the greatest animated trilogys of all time. The story is great, which follows a panda who is just trying his best to become what he is believed to be. The action, humor, and overall story is one of dreamworks greatest accomplishes."" ]";0.0;0.0;0.0;0.0;(0.65, 0.525);0.65;0.525;inf;0.65
the-iron-giant;10;homer4president;/user/homer4president;Mar 11, 2015;"[ ""The Iron Giant is really a great film. You know those films that have a boy and his dog (Lassie). a boy and his whale (Free Willie), a boy and his alien (E.T.), and a boy and his Gamera (Gamera the Brave)? This film decided to do a boy and his giant robot in a nutshell. The story is great, the characters are great, and I love what the Iron Giant was revealed to be at the end. It's just awesome! If you haven't seen this movie, then I suggest you do so."" ]";0.0;0.0;0.0;0.0;(0.440909090909091, 0.8545454545454544);0.44090909090909103;0.8545454545454544;-2.1163636363636376;0.6492424242424243
hellboy;7;homer4president;/user/homer4president;Mar 28, 2015;"[ ""Hellboy is an amazing thrill ride. Not only was it great to pick Ron Perlman, it was great to make this movie. The plot was fun, the effects and music were great, and the fish guy was awesome. My only tiff is sometimes the effects were cheesy. But if you can deal with that youll love this movie."" ]";0.0;0.0;0.0;0.0;(0.43, 0.7949999999999999);0.43;0.7949999999999999;-2.0640000000000005;0.6383333333333333
captain-america-civil-war;10;blue-ninja;/user/blue-ninja;May  9, 2016;"[ ""I have watch this Cap 3 Civil War movie twice, i can say this is Amazing Perfect & Brilliant MCU movie after Cap 2 The Winter Soldier when Story is look Great and 12 Character Superhero in Airport scene action is look so balanced. Russo brothers is the best director MCU, can't wait the next project Avengers Infinity War part 1 & 2"" ]";2.0;6.0;2.0;4.0;(0.6285714285714287, 0.5785714285714285);0.6285714285714287;0.5785714285714285;inf;0.6285714285714287
superman;9;supermann234;/user/supermann234;Nov 17, 2014;"[ ""This movie is probably still the best Superman movies compared to modern-day Superman movies. Despite having no fight scenes, this movie sticks very closely to the comics, and is iconic as a Superman movie. This movie also has the best Superman theme. I am very impressed on how these people make such a good movie even in the 1970s."" ]";0.0;0.0;0.0;0.0;(0.6285714285714287, 0.5000000000000001);0.6285714285714287;0.5000000000000001;inf;0.6285714285714287
star-wars-episode-vii---the-force-awakens;9;homer4president;/user/homer4president;Dec 18, 2015;"[ ""Probably one of the best movies I have seen all year and definitely so much better than the prequels. When I saw the crawl text pop up again, I couldn't believe it was finally here. Got goosebumps. Great acting, great action, great everything really. Looking forward to the next one."" ]";17.0;64.0;17.0;47.0;(0.42000000000000004, 0.43500000000000005);0.42;0.4350000000000001;-2.0160000000000005;0.6283333333333333
batman-begins;7;homer4president;/user/homer4president;Mar 13, 2015;"[ ""Batman Begins is the story of Bruce Wayne's transformation onto the Dark Knight. This movie is much darker than it's predecessors but has a great story line. This movie is accompanied by a great soundtrack and good acting. Christian Bale is perfect for the role of Batman."" ]";0.0;0.0;0.0;0.0;(0.41875, 0.4625);0.41875;0.4625;-2.0100000000000007;0.6270833333333333
wonder-woman;8;CineAutoctono;/user/CineAutoctono;Jun  7, 2017;"[ ""\""Wonder Woman\"" was an exceptional film, the story, and the scripts were very good, the special effects were good, and the performances very good, but nothing compares to the great performance of Gal Gadot, this actress put \""girl power \""To this film, transmitting, courage, courage, love and beauty, Patty Jenkins managed to make this movie in an intelligent way, and the message finally came to my heart, Wonder Woman is the super heroine we need, so that the Extended Universe DC Comics resurrects after the punch of criticism in his latest films, and for fans and not so fans of DC, surprise us, excite us and fondle us with this character. A Wonderful Movie, like Wonder Woman !."" ]";0.0;2.0;0.0;2.0;(0.623095238095238, 0.7956746031746031);0.6230952380952379;0.7956746031746031;inf;0.6230952380952379
